{
  "contract": {
    "name": "hausman-hub-climate-setup-options",
    "version": 1
  },
  "generated_at": 1784280000000,
  "snapshot_revision": 8115739542118920,
  "data_status": "current",
  "draft_creation_allowed": true,
  "control_channels": [
    "universal_ir",
    "yandex_remote",
    "direct_wifi"
  ],
  "display_names": {
    "room_status": {
      "available": "Можно выбрать",
      "data_stale": "Нужно обновить данные",
      "source_missing": "Комната больше не найдена"
    },
    "device_types": {
      "air_conditioner": "Кондиционер",
      "radiator_thermostat": "Термоголовка радиатора",
      "humidifier": "Увлажнитель",
      "floor_heating": "Тёплый пол",
      "temperature_sensor": "Датчик температуры",
      "humidity_sensor": "Датчик влажности"
    },
    "device_status": {
      "available": "Можно добавить",
      "already_configured": "Уже добавлено",
      "unavailable": "Устройство недоступно",
      "unsupported": "Тип устройства не поддерживается",
      "data_stale": "Нужно обновить данные",
      "source_missing": "Устройство больше не найдено",
      "registry_mismatch": "Нужно проверить привязку устройства"
    },
    "suggestion_reasons": {
      "detected_room": "Устройство найдено в этой комнате",
      "already_configured": "Устройство уже назначено этой комнате",
      "device_unavailable": "Устройство сейчас недоступно",
      "unsupported_device": "Тип устройства не поддерживается",
      "data_stale": "Нужно обновить данные",
      "device_missing": "Настроенное устройство больше не найдено",
      "registry_mismatch": "Текущая привязка не совпадает с настройкой HausmanHub",
      "room_unavailable": "Комната сейчас недоступна для выбора",
      "unassigned_room": "Комнату нужно выбрать вручную"
    },
    "modes": {
      "observe": "Только наблюдение",
      "automatic": "Автоматическое управление"
    },
    "strategies": {
      "soft": "Плавно",
      "normal": "Обычно",
      "aggressive": "Быстро"
    }
  },
  "rooms": [
    {
      "id": "kids",
      "name": "Kids",
      "status": "available",
      "selectable": true
    },
    {
      "id": "living",
      "name": "Living room",
      "status": "available",
      "selectable": true
    }
  ],
  "devices": [
    {
      "candidate_id": "candidate_0001",
      "name": "Kids humidifier",
      "room_id": "kids",
      "suggested_types": [
        "humidifier"
      ],
      "recommended_type": "humidifier",
      "status": "available",
      "suggested_room_id": "kids",
      "suggested_room_name": "Kids",
      "reason": "detected_room",
      "can_add": true
    },
    {
      "candidate_id": "candidate_0002",
      "name": "Living AC",
      "room_id": "living",
      "suggested_types": [
        "air_conditioner"
      ],
      "recommended_type": "air_conditioner",
      "status": "available",
      "suggested_room_id": "living",
      "suggested_room_name": "Living room",
      "reason": "detected_room",
      "can_add": true
    }
  ]
}
